{
  "spec_id": "order",
  "spec_version": 1,
  "generated_from_diff": "v0 -> v1 (initial)",
  "created": "2026-04-10T12:00:00Z",
  "tasks": [
    {
      "id": "order-v1-001",
      "title": "DB 스키마 설계 및 마이그레이션 — Application, Recipient, Product 테이블",
      "description": "신청서(Application), 수취인(Recipient), 상품(Product) 핵심 테이블 생성. Prisma 스키마 정의, MariaDB 마이그레이션 실행. FK 관계, 인덱스, enum 타입 정의 포함.",
      "status": "pending",
      "priority": "critical",
      "depends_on": [],
      "estimated_complexity": "high",
      "source_change": "ADD: Data Model — Application, Recipient, Product entities",
      "files_affected": ["backend/prisma/schema.prisma"],
      "prp_plan_path": null,
      "created": "2026-04-10T12:00:00Z",
      "started": null,
      "completed": null,
      "verified": null
    },
    {
      "id": "order-v1-002",
      "title": "DB 스키마 설계 — ProductImage, TrackingNumber, ServiceRequest, Insurance, Payment, Terms 테이블",
      "description": "상품 이미지, 트래킹번호, 요청사항, 보험, 결제, 약관동의 테이블 생성. jsonb 필드(포장/제거/통관/기타 옵션), constraint(이미지 5개, 트래킹 5개) 포함.",
      "status": "pending",
      "priority": "critical",
      "depends_on": ["order-v1-001"],
      "estimated_complexity": "high",
      "source_change": "ADD: Data Model — ProductImage, TrackingNumber, ServiceRequest, Insurance, Payment, TermsAgreement",
      "files_affected": ["backend/prisma/schema.prisma"],
      "prp_plan_path": null,
      "created": "2026-04-10T12:00:00Z",
      "started": null,
      "completed": null,
      "verified": null
    },
    {
      "id": "order-v1-003",
      "title": "Backend API — POST /api/v1/orders (신청서 접수)",
      "description": "신청서 접수 엔드포인트. 요청 데이터 Zod 스키마 검증, 통관유형 자동 설정 로직, 트랜잭션으로 전체 데이터 저장, 신청서ID 자동 생성(FD/PA + 날짜 + seq).",
      "status": "pending",
      "priority": "critical",
      "depends_on": ["order-v1-001", "order-v1-002"],
      "estimated_complexity": "high",
      "source_change": "ADD: API — POST /api/v1/orders",
      "files_affected": ["backend/src/orders/orders.controller.ts", "backend/src/orders/orders.service.ts", "backend/src/orders/dto/create-order.dto.ts"],
      "prp_plan_path": null,
      "created": "2026-04-10T12:00:00Z",
      "started": null,
      "completed": null,
      "verified": null
    },
    {
      "id": "order-v1-004",
      "title": "Backend API — POST /api/v1/orders/draft, GET /api/v1/orders/drafts (임시저장)",
      "description": "임시저장 생성 및 목록 조회 엔드포인트. 부분 데이터 저장 허용, 임시저장 목록 페이지네이션.",
      "status": "pending",
      "priority": "high",
      "depends_on": ["order-v1-003"],
      "estimated_complexity": "medium",
      "source_change": "ADD: API — POST /api/v1/orders/draft, GET /api/v1/orders/drafts",
      "files_affected": ["backend/src/orders/orders.controller.ts", "backend/src/orders/orders.service.ts"],
      "prp_plan_path": null,
      "created": "2026-04-10T12:00:00Z",
      "started": null,
      "completed": null,
      "verified": null
    },
    {
      "id": "order-v1-005",
      "title": "Backend API — GET /api/v1/customs/search (통관품목 검색)",
      "description": "HS코드 키워드 검색 엔드포인트. 검색어로 통관품목 조회, HS코드/품목명 반환.",
      "status": "pending",
      "priority": "critical",
      "depends_on": ["order-v1-001"],
      "estimated_complexity": "medium",
      "source_change": "ADD: API — GET /api/v1/customs/search",
      "files_affected": ["backend/src/customs/customs.controller.ts", "backend/src/customs/customs.service.ts"],
      "prp_plan_path": null,
      "created": "2026-04-10T12:00:00Z",
      "started": null,
      "completed": null,
      "verified": null
    },
    {
      "id": "order-v1-006",
      "title": "Backend API — GET /api/v1/insurance/premium (보험료 조회)",
      "description": "상품 총금액 기반 보험료 조회. 외부 보험 API 연동 또는 내부 계산 로직.",
      "status": "pending",
      "priority": "high",
      "depends_on": [],
      "estimated_complexity": "medium",
      "source_change": "ADD: API — GET /api/v1/insurance/premium",
      "files_affected": ["backend/src/insurance/insurance.controller.ts", "backend/src/insurance/insurance.service.ts"],
      "prp_plan_path": null,
      "created": "2026-04-10T12:00:00Z",
      "started": null,
      "completed": null,
      "verified": null
    },
    {
      "id": "order-v1-007",
      "title": "Backend — 통관유형 자동 설정 비즈니스 로직",
      "description": "수입방식/상품정보 기반 통관유형 자동 결정. 개인전자상거래: 기본 목록통관, 식품 HS코드 OR 총금액 초과 OR 단가 초과 시 일반통관. 사업자: 항상 일반통관.",
      "status": "pending",
      "priority": "critical",
      "depends_on": ["order-v1-003"],
      "estimated_complexity": "medium",
      "source_change": "ADD: FR-024, FR-039 — 통관유형 자동 설정 규칙",
      "files_affected": ["backend/src/orders/customs-type.calculator.ts"],
      "prp_plan_path": null,
      "created": "2026-04-10T12:00:00Z",
      "started": null,
      "completed": null,
      "verified": null
    },
    {
      "id": "order-v1-008",
      "title": "Backend API — GET /api/v1/addresses, GET /api/v1/inventory, GET /api/v1/products/recent",
      "description": "주소록 조회, 재고 목록 조회, 기존 상품정보 조회 엔드포인트.",
      "status": "pending",
      "priority": "high",
      "depends_on": ["order-v1-001"],
      "estimated_complexity": "medium",
      "source_change": "ADD: API — addresses, inventory, products/recent",
      "files_affected": ["backend/src/addresses/addresses.controller.ts", "backend/src/inventory/inventory.controller.ts", "backend/src/products/products.controller.ts"],
      "prp_plan_path": null,
      "created": "2026-04-10T12:00:00Z",
      "started": null,
      "completed": null,
      "verified": null
    },
    {
      "id": "order-v1-009",
      "title": "Frontend — 신청서 페이지 레이아웃 (One-Page 스크롤)",
      "description": "App Router 페이지 생성. One-Page 레이아웃, 6개 섹션 컨테이너, 상단 고정 헤더(뒤로/제목/임시저장), 하단 고정 버튼(임시저장/접수신청).",
      "status": "pending",
      "priority": "critical",
      "depends_on": [],
      "estimated_complexity": "medium",
      "source_change": "ADD: UI — 신청서 작성 화면 레이아웃",
      "files_affected": ["frontend/app/(user)/order/page.tsx", "frontend/app/(user)/order/layout.tsx"],
      "prp_plan_path": null,
      "created": "2026-04-10T12:00:00Z",
      "started": null,
      "completed": null,
      "verified": null
    },
    {
      "id": "order-v1-010",
      "title": "Frontend — 섹션 1: 물류센터/운송방식/수입방식 선택 컴포넌트",
      "description": "라디오 버튼 그룹 3개. 물류센터 선택 → 운송방식 옵션 동적 필터링 연동. 수입방식 선택 → 통관유형 상태 연동.",
      "status": "pending",
      "priority": "critical",
      "depends_on": ["order-v1-009"],
      "estimated_complexity": "medium",
      "source_change": "ADD: UI — FR-003, FR-004, FR-005, FR-038",
      "files_affected": ["frontend/components/user/order/LogisticsSection.tsx"],
      "prp_plan_path": null,
      "created": "2026-04-10T12:00:00Z",
      "started": null,
      "completed": null,
      "verified": null
    },
    {
      "id": "order-v1-011",
      "title": "Frontend — 섹션 2: 수취인정보 입력 컴포넌트",
      "description": "수취인명/연락처/통관번호/주소 입력 폼. 주소록 불러오기/기본배송지 연동. 개인/사업자 조건부 필드 노출. 주소 검색 API 연동.",
      "status": "pending",
      "priority": "critical",
      "depends_on": ["order-v1-009"],
      "estimated_complexity": "high",
      "source_change": "ADD: UI — FR-006~FR-011",
      "files_affected": ["frontend/components/user/order/RecipientSection.tsx", "frontend/components/user/order/AddressPopup.tsx"],
      "prp_plan_path": null,
      "created": "2026-04-10T12:00:00Z",
      "started": null,
      "completed": null,
      "verified": null
    },
    {
      "id": "order-v1-012",
      "title": "Frontend — 섹션 3: 상품정보 입력 컴포넌트",
      "description": "상품 카드 리스트, 추가/삭제/복사. 통관품목 검색 팝업, HS코드 자동입력. 상품명/옵션/단가×수량/순량 입력. 이미지 업로드(드래그앤드롭), URL 입력. 트래킹번호 멀티 입력. 총계 실시간 계산.",
      "status": "pending",
      "priority": "critical",
      "depends_on": ["order-v1-009"],
      "estimated_complexity": "complex",
      "source_change": "ADD: UI — FR-012~FR-023, FR-040~FR-042",
      "files_affected": ["frontend/components/user/order/ProductSection.tsx", "frontend/components/user/order/ProductCard.tsx", "frontend/components/user/order/CustomsSearchPopup.tsx", "frontend/components/user/order/TrackingNumberInput.tsx", "frontend/components/user/order/ImageUploader.tsx"],
      "prp_plan_path": null,
      "created": "2026-04-10T12:00:00Z",
      "started": null,
      "completed": null,
      "verified": null
    },
    {
      "id": "order-v1-013",
      "title": "Frontend — 통관유형 자동 설정 클라이언트 로직",
      "description": "상품 정보 변경 시 실시간 통관유형 재계산. 식품 HS코드 판별, 총금액/단가 기준 초과 검사. 자동 변경 시 알림 토스트 표시.",
      "status": "pending",
      "priority": "critical",
      "depends_on": ["order-v1-012"],
      "estimated_complexity": "medium",
      "source_change": "ADD: UI — FR-024 통관유형 자동 설정 + 알림",
      "files_affected": ["frontend/hooks/useCustomsType.ts", "frontend/lib/customs-rules.ts"],
      "prp_plan_path": null,
      "created": "2026-04-10T12:00:00Z",
      "started": null,
      "completed": null,
      "verified": null
    },
    {
      "id": "order-v1-014",
      "title": "Frontend — 섹션 4: 검수사항/부가서비스 컴포넌트",
      "description": "검수사항 라디오(4옵션), 부가서비스 라디오(3옵션). 빠른출고/맞춤 선택 시 상세옵션 패널(포장/제거/통관/기타 체크박스). 물류요청사항 텍스트 입력.",
      "status": "pending",
      "priority": "high",
      "depends_on": ["order-v1-009"],
      "estimated_complexity": "medium",
      "source_change": "ADD: UI — FR-025, FR-026, FR-027",
      "files_affected": ["frontend/components/user/order/ServiceRequestSection.tsx", "frontend/components/user/order/AdditionalOptions.tsx"],
      "prp_plan_path": null,
      "created": "2026-04-10T12:00:00Z",
      "started": null,
      "completed": null,
      "verified": null
    },
    {
      "id": "order-v1-015",
      "title": "Frontend — 섹션 5: 화물보험 컴포넌트 + 레이어팝업",
      "description": "화물보험 체크박스(필수). 클릭 시 레이어팝업(요약/보상/보험료/약관). 팝업 내 약관 동의 + 확인 → 자동 체크. 보험료 API 연동.",
      "status": "pending",
      "priority": "critical",
      "depends_on": ["order-v1-009", "order-v1-006"],
      "estimated_complexity": "high",
      "source_change": "ADD: UI — FR-028, FR-029",